Номер задачи,Дано,Ещё дано,Найти,Критерий,Текущий статус
0,корпус текстов,нет,векторные представления слов,к.к.С,это бейзлайн
1,векторные представления слов,экспертный набор близостей,скорректированные векторные представления слов,к.к.С,статья принята в CEUR
2,векторные представления слов,другие векторные представления слов,скорректированные и/или новые векторные представления слов,к.к.С,статья готовится на DAMDID
3,нет,экспертный набор близостей,векторные представления слов,к.к.С,ВКР Александра Сенина
4,корпус текстов,генератор «правильных» троек слов,векторные представления слов,к.к.С,возможно статья на Q1/Q2
5,корпус текстов,генератор «правильных» троек слов,тезаурус,wordnet,возможно статья на Q1/Q2
