Id, название, сайт, текущий статус, срок 1, результат 1, срок 2, результат 2, итог
1, ITNT, itnt-conf.org, текст статьи до 7 апреля, 27.01.2021 Окончание приёма тезисов, тезисы приняты, 07.04.2021 Окончание приёма расширенных версий статей в англоязычные сборники, ,
2, DAMDID/RCDL'2021, www.damdid2021.misis.ru (ссылка не работает), название до 30 марта, Preliminary title of the paper: March 30 2021,, Submission deadline for papers: April 30 2021, ,
3, журнал В.А.Сухомлина,,нужно название журнала,,,,,
4, Russian Supercomputing Days, russianscdays.org/en, нужно выбрать что подавать, 15.04.21 Окончание приёма работ,,,,
5, Нейроинформатика-2021, neuroinfo.ru/index.php/ru, нужно выбрать что подавать, 20.05.21 Окончание приёма докладов(!),,,,
6, ICAICA 2021, www.icaica.org, нужно выбрать что подавать, 30.04.21 Окончание приёма работ,,,,
